disease,herbs,therapy,diet,vata_effect,pitta_effect,kapha_effect
Arthritis,"Shallaki, Guggulu, Ashwagandha","Abhyanga, Swedana","Warm food, ghee, turmeric milk","Reduces dryness and joint stiffness","Controls inflammation","Improves mobility and reduces heaviness"
Diabetes,"Gudmar, Neem, Amla","Udvarthana","Low sugar diet, bitter vegetables","Balances irregular digestion","Cools excess heat","Reduces heaviness and lethargy"
Hypertension,"Arjuna, Brahmi","Shirodhara","Low salt, fresh fruits","Calms nervous system","Reduces excess heat","Improves circulation"
Common Cold,"Tulsi, Ginger, Mulethi","Steam inhalation","Warm fluids, light food","Warms body","Balances mild heat","Reduces mucus"
Asthma,"Vasaka, Pippali","Vamana","Warm diet, avoid cold food","Improves breathing","Reduces irritation","Clears congestion"
Migraine,"Brahmi, Shankhpushpi","Shiro Abhyanga","Light meals, hydration","Calms nervous system","Cools head","Reduces heaviness"
Gastritis,"Yashtimadhu, Amla","Virechana","Soft food, avoid spicy","Soothes digestion","Reduces acidity","Improves metabolism"
Anemia,"Punarnava, Amla","Rasayana","Iron rich food, dates","Improves circulation","Enhances blood quality","Boosts energy"
