disease,symptoms
Arthritis,"joint pain, stiffness, swelling, morning stiffness"
Diabetes,"frequent urination, excessive thirst, fatigue, weight loss"
Hypertension,"headache, dizziness, blurred vision, chest pain"
Common Cold,"runny nose, sneezing, sore throat, cough"
Asthma,"shortness of breath, wheezing, chest tightness, cough"
Migraine,"severe headache, nausea, sensitivity to light"
Gastritis,"stomach pain, bloating, nausea, indigestion"
Anemia,"fatigue, weakness, pale skin, shortness of breath"
